Chart #,index,level,interaction,composite,v_num,l2,l3,command,query,question,lookup-visual,lookup-nonvisual,compositional-visual,compositional-nonvisual,open-ended
31,818,extracomplex,TRUE,FALSE,1,The  most popular PL team in Korea is Tottenham Hotspur.,The most popular PL teams in Europe is Liverpool.,Make a world map where each country's color is decided by the country's most favorite soccer team in premier league,"map chart, hue determined by the team with highest value",What is the most preferred soccer team in each country?,"What is the color representing ""Manchester united""?",Let me know the max query rate of Manchester United in China.,Which color occupies the largest area in this chart?,Is the most popular PL team in South Korea and Japan different?,Why Tottenham Hotspur is the most popular team in South Korea?
32,874,medium,FALSE,FALSE,1,"The highest percentage of responses was 17, and the lowest was 2.",The chart shows that more people are comfortable with data being shared with the governement than not.,"Make a bar chart with ""Responce"" as x-axis and the percentage of ""Responce"" as y-axis",Bar chart grouped by Responce,How comfortable are people with their data being shared with governement?,What do the heights of the bars mean?,"How many responded with ""Don't know""?",What is the most common height of the bar?,How many people gave response of 4 or lower?,Why would the score of 9 be much less common than adjacent scores?
33,893,extracomplex,TRUE,TRUE,2,The correlation coefficient between change in energy consumption and GDP growth is 0.53.,Most countries have experienced growth in GDP between 1981 and 2021.,"Create a heat map with GDP growth rate and change in energy consumption as variables, and the color red indicating high occurence, brown indicating low occurrence, and yellow indicator medium. 
Make separate lines to mark the average and the data point for China.","Enery consumption vs. GDP growth. 
Global average vs. China","Does increase in energy consumption necessary lead to growth in GDP?
How was China's energy efficiency compared to the rest of the world?",What do the grey lines mean?,How is the global average GDP Growth?,How many cells have the color red?,What is the relationship between increate in energy consumption and GDP growth?,How would you explain the outlier with decrease in energy consumption and high GDP Growth?
34,911,extracomplex,TRUE,TRUE,2,The total number of incidences across all stations and quarters is 58794.,The Central district has the highest percentage of responses above 7.7 minute standard across all quaters.,"Show me a heat map, for each financial quarter, of responses above 7.7 minute standard of the stations grouped by district.
Draw a line chart for each station's ranking within their districts.","Percentage of response time over 7.7 minutes grouped by stations grouped by districts.
Station rankings by financial quarters.","How well is the 7.7 minute standard being kept?
Which stations are the worst offenders?",Which district is colored darkest in Q1?,How many stations are in the Eastern district?,Which district has the largest change in color between Q1 and Q4?,Which station improved their ranking the most over the year within their district?,Why does the Central district consistently have high percentage of slow responses despite its small size?
35,1106,extracomplex,FALSE,TRUE,1,The minimum happens with Controlled South East Asian group.,"Generally, non-white ethnic groups show wider range of values than white ethnic groups.",Draw a layered chart showing changes in hate crime rate for different ethnic groups.,Hate crime changes before after COVID-19,What is the predicted value for each of the ethnicity group using controlled and uncontrolled models?,What color represents South East Asian?,What is the average for Black groups?,Which color of line has the shortest length?,Why do certain groups show higher values than others?,Why is Indian the only ethnic group with positive mean?
36,1194,medium,FALSE,FALSE,1,The average access to electricity in 2020 is 44.65.,Burundi has had the least access of electricity ever since 2001.,Make a stacked bar chart of East African countries' access to electricity from 2000 to 2020.,Access to electricity order by year,How does the access to the electricity change over time in countries in east africa?,What does the color green mean?,What was Somali's access to electricity in 2005?,What does the height of red bar mean?,Which country had the most increase in access to electricity in the last decade?,What contributed Somalia's sudden increase in access to electricity in 2010?
37,1198,extracomplex,TRUE,FALSE,1,The maximum total energy consumption happened in 2019.,The only instance of decrease in total energy consumption happened between 2019 and 2020.,Draw an area chart of energy consumption in Africa by source,Energy consumption by source,"Which energy resource is the most popular in africa among the list: geo biomass, nuclear, solar, wind, hydro, coal, gas, and oil?",Which color is hydro energy represented by?,What is the consumption of nuclear energy in 2020?,What does the size of green area represent?,Which energy source saw the greatest increase in energy consumption by percentage since 2000?,Why were there no nuclear energy consumption prior to 1983?
38,1352,complex,FALSE,FALSE,1,The maximum for London happened around 2016-2017.,Different areas generally show similar trends in private housing rental prices.,Plot multi-line chart showing error values for experienmental index of private housing rental prices for different regions in England over the years.,Error value for experimental index of private housing rental prices over the years,Can you compare the rental prices for the houses in different regions in the UK?,How many lines are there?,When did maximum for Southwest region occur?,Which line has the largest difference between the highest and lowest points?,"Which region, if any, shows a distinct trend different from others?",Why was there a consistent drop in rental prices across the nation in 2010?
39,1354,extracomplex,TRUE,TRUE,4,The total number of voters in Colombia is 36783940.,Consulados has the lowest voting rate of all the departments.,"Draw a stacked horizontal bar chart to denote the total number and number of voters in Columbia
Make a heatmap where x is total voters by department and y is department count, using colors to represent the abstention rate
Generate a distribution of total voters by municipality
Generate a distribution using tick of total voters by department","stacked bar chart, abstention rate in Colobia by department
heatmap, voters by department vs. department count
Distribution using tick, total voters by municipality
Distribution chart (1D), total voters by department","Which department has the highest number of total voters?
Which municipality has the lowest number of total voters?
Which department has the highest abstention rate?
How many people voted by each region in Columbia?",What does the width of the pink bars mean?,What is abstention rate of Cauca?,What is the average width of blue bars?,How many departments have more than 2000000 total voters?,Why does Consulados have such low voting rate?
40,1356,extracomplex,TRUE,TRUE,5,"The maximum whereabouts occurs at UPZ85, whereas the minimum occurs at UPZ29.",UPZ111 has the greatest gender districution difference.,"Draw a bar chart to see the total population by UPZ
Add a line chart to see the percentage of women
Add another line chart to see the percentage of men
Make a circle plot showing total population for each region
Draw a gender distribution by UPZ","UPZ vs. total population, bar chart
UPZ vs. total population, point chart
UPZ by Women_20, line chart
Line chart, Men_20 by UPZ
Distribution chart of UPZ","What is gender distribution by UPZ?
What is the total popoulation for each of the region?
What is the percentage of women in each place?
How many men are in each of the UPZ?
Which UPZ has the highest population in total?",What does the y-axis represent?,What is the name of UPZ17?,What is the percentage of women in the UPZ with the largest bar?,What is the average percentage of male population?,Why does UPZ111 have such large difference in gender distribution?
41,1361,complex,TRUE,FALSE,1,The average yearly quantify for MS is 91560.,Most states show a clear pattern of onion quantity the repeats yearly.,Make a stacked area chart of onion quality by state and date,"Stacked area chart, sum of quantity over time, colored by state",How  has quantity of onions change in the years between 1996 and 2016?,Which state has the largest area in the chart?,How much onion was produces by TN in Feb 2014?,What is the sum total of dark green and light violet areas?,Which state has the lowest average quantity?,What causes the regular spike in onion quantities?
42,1381,simple,FALSE,FALSE,1,"The maximum quantities for broom, monkey, and slipper are 38.21, 47.34, and 50.90 respectively",Broom consistently had lower quantities than monkey or slipper for most of the time.,"Create a line chart of quantities of broom, monkey, and slipper over time.","Line chart, quantity over time","How did quantities of broom, monkey, and slipper change over time?",What does the horizontal axis indicate?,At which time did money have the highest quantity?,What does the slope of each line mean?,Which item had the highest growth rate?,Why did all three quantities increase over time?
43,1406,complex,FALSE,FALSE,1,The average percentage of money bonds for small/mid groups is 69.27.,The poverty rate is most spread in the rural group.,Make multiple point charts showing relationship between poverty rate and money bond rate of each location organized by urbanicity.,"Poverty rate by money bonds, charts divided by type of offense and urbanicity, points divided by year, sized by population, scatterplot",Are there any correlation between poverty rate and money bond rate?,What is the number of populaton with the largest size of circle?,What is the poverty rate in urban area of 2014?,What is the most common size of blue circles?,"How many locations in rural groups have populations smaller than 600,000?",Do felony and misdemeanor show any distinct charateristics?
44,1513,complex,TRUE,FALSE,1,"The highest flux for Cancer7 is 0.100 with metabolite orn_m, while the fifth highest flux for it is 0.0888 with metabolite cytd_m.",amp_m has high flux for all samples.,Make a heatmap of metabolite flux for each sample,"Heatmap, sample ID vs. metabolite, colored by flux",Which metabolites could be useful for distinguishing cancrous samples? ,Does the yellow flux mean higher or lower value?,Is the flux of ca2_m vs. Cancer7 sample lower than 0.001?,"Is there any correlation between the value of flux and the metabolites located on different rows (e.g., the higher rows and lower rows)?",How many metabolites are there?,Why do certain metabolite fluxes differ from sample to sample?
45,1831,medium,FALSE,FALSE,1,The cumulative employment growth for 65+ age group peaked in 2020-01-02.,65+ age group was the only group with positive cumulative growth after 2020-01-09.,Draw a line chart for UK employment growth by age group,"Employment rate by time for different age groups, line chart",Is there any significant difference in employment rate between age groups in UK?,What is the employment rate of the black line on January 9?,"What is the employment rate for the age group 16-24 on January 6, 2020?","What are the difference between two mean employement rates of two groups that have the largest difference in height on January 3rd, 2020?",Which age group experienced the largest change in employment between 2019-10-01 and 2020-01-10?,Why there is such a huge gap between the group of 16-24 and other groups after January 6?
46,1953,extracomplex,TRUE,TRUE,2,"Between September 2021 to January 2022, the lowest number of cases detected in Canterbury-Bankstoen is November 2021, and the number of cases are 798.",The number of COVID-19 cases skyrockets since December 2021.,"Draw a cumulative line of number of people who got COVID 19 in south western Sydney
Generate a stacked bar chart for daily cases who got COVID where the color represents the neighborhood in the south western Sydney region","Stacked bar chart, date by daily cases of COVID-19
Cumulative line chart, COVID-19 cases over time","When was the most serious time for the south western Sydney as the COVID 19 spread out?
Which local government area was the most severly damaged by the COVID 19?",Which LGA used red bars to represent the daily COVID cases?,When was the date there were the most number of COVID 19 cases detected in a single day?,Which month has the steepest slope of the line for the daily COVID 19 cases?,When does the cumulative number of COVID cases peaked in 2021?,What caused an abrupt increase of COVID 19 cases on December 2021?
47,1961,extracomplex,TRUE,TRUE,1,TRPO has the second largest value when the step reached 1 million.,The return of the agent named SAC starts to saturate after its step of 500K.,Represent line charts for the return for agents on the y-axis and the step of environment on the x-axis,Return by env step for agent type,Which agent has the highest return value as the env step goes on?,What does the vertical axis represent?,What is the standard deviation of NPG agent at 552960 step?,What is the average return value for the red line?,Which agent has the smallest standard deviation on average?,Why does the return fluctuate a lot in case of the SAC agent?