commands,axes,axes2,ptypes,dnames,vids,scores,scores2
Could you make a bar chart with 'Creative Type' on the x-axis and its count on the y-axis?,Non-technical-Technical,Implicit-Explicit,command,movies,singleAttrBar,2,3
It is required to create a bar chart with 'Creative Type' on the x-axis and its count on the y-axis.,Subjective-Objective,Implicit-Explicit,command,movies,singleAttrBar,4,5
You might want to make a bar graph with 'Creative Type' on the x-axis and its count on the y-axis.,Non-technical-Technical,Subjective-Objective,command,movies,singleAttrBar,2,2
Please create a bar chart with 'Creative Type' on the x-axis and the count on the y-axis.,Colloquial-Standard,Implicit-Explicit,command,movies,singleAttrBar,4,3
Generate a bar chart with 'Creative Type' as the independent variable and its count as the dependent variable.,Non-technical-Technical,Implicit-Explicit,command,movies,singleAttrBar,5,5
Make a picture with 'Creative Type' along the bottom and how many there are going up the side.,Non-technical-Technical,Implicit-Explicit,command,movies,singleAttrBar,1,1
"It's a bar chart with 'Creative Type' on the x-axis and its count on the y-axis, arranged in descending order.",Non-technical-Technical,Implicit-Explicit,query,movies,singleAttrBar,4,3
"Here we have a bar chart, with 'Creative Type' on the x-axis, and the tally of each 'Creative Type' on the y-axis, arranged in a descending order.",Colloquial-Standard,Non-technical-Technical,query,movies,singleAttrBar,3,2
"Bar chart, 'Creative Type' on x-axis, count on y-axis, arranged from most to least.",Non-technical-Technical,Implicit-Explicit,query,movies,singleAttrBar,2,5
"The bar chart delineates 'Creative Type' on the x-axis, with the enumeration of each 'Creative Type' on the y-axis, arranged in a descending order.",Colloquial-Standard,Non-technical-Technical,query,movies,singleAttrBar,5,3
"It's a chart with creative types and their counts, sorted from most to least.",Non-technical-Technical,Subjective-Objective,query,movies,singleAttrBar,1,4
What is the tally of each 'Creative Type' displayed on the bar chart?,Colloquial-Standard,Non-technical-Technical,question,movies,singleAttrBar,4,5
Could you specify the count of each 'Creative Type' on the bar chart?,Colloquial-Standard,Subjective-Objective,question,movies,singleAttrBar,5,5
"It appears we should understand the count of each 'Creative Type' on the bar chart, correct?",Subjective-Objective,Implicit-Explicit,question,movies,singleAttrBar,2,2
Do you know the count of each 'Creative Type' on the bar chart?,Colloquial-Standard,Implicit-Explicit,question,movies,singleAttrBar,1,2
What's the tally of each 'Creative Type' on the bar chart?,Colloquial-Standard,Non-technical-Technical,question,movies,singleAttrBar,4,2
The exact count of each 'Creative Type' on the bar chart is needed.,Subjective-Objective,Implicit-Explicit,question,movies,singleAttrBar,5,5
"I feel like I'm not quite sure about the numbers for each 'Creative Type' on the bar chart, do you get it?",Subjective-Objective,Implicit-Explicit,question,movies,singleAttrBar,1,1
Create a bar chart showing movie genres and their earnings.,Non-technical-Technical,Implicit-Explicit,command,movies,bar,3,2
I believe it would be beneficial to construct a bar chart with the major film genres and their average worldwide gross.,Non-technical-Technical,Subjective-Objective,command,movies,bar,1,3
Generate a bar chart with 'Major Genre' as the x-axis and the mean 'Worldwide Gross' as the y-axis.,Non-technical-Technical,Subjective-Objective,command,movies,bar,5,4
It is vital to generate a bar diagram with the primary genre on the x-axis and the mean global gross on the y-axis.,Colloquial-Standard,Non-technical-Technical,command,movies,bar,4,5
How about we make a bar chart with 'Major Genre' on the x-axis and the average 'Worldwide Gross' on the y-axis? I think it'll work well.,Colloquial-Standard,Subjective-Objective,command,movies,bar,2,2
Construct a bar chart with 'Major Genre' on the x-axis and the average 'Worldwide Gross' on the y-axis. This will accurately represent the data.,Colloquial-Standard,Subjective-Objective,command,movies,bar,5,1
Required: a bar chart with 'Major Genre' on the x-axis and the average 'Worldwide Gross' on the y-axis.,Subjective-Objective,Implicit-Explicit,command,movies,bar,4,5
We need to generate a bar chart with 'Major Genre' as the x-axis and the mean 'Worldwide Gross' as the y-axis.,Non-technical-Technical,Subjective-Objective,command,movies,bar,4,4
We need to create a simple diagram showing movie types and their worldwide earnings.,Non-technical-Technical,Subjective-Objective,command,movies,bar,4,1
It would be efficient to fabricate a bar chart with the principal genre on the x-axis and the mean aggregate worldwide gross on the y-axis.,Colloquial-Standard,Non-technical-Technical,command,movies,bar,5,3
"I feel like this bar chart is trying to show us the average worldwide gross for each major genre, you know?",Subjective-Objective,Implicit-Explicit,query,movies,bar,1,1
"""That bar chart with the mean 'Worldwide Gross' for each 'Major Genre'.""",Non-technical-Technical,Implicit-Explicit,query,movies,bar,1,4
"""A bar chart, it's about 'Major Genre' and the mean of 'Worldwide Gross'.""",Colloquial-Standard,Implicit-Explicit,query,movies,bar,2,3
"""The bar chart explicitly represents 'Major Genre' and the mean of 'Worldwide Gross'.""",Colloquial-Standard,Implicit-Explicit,query,movies,bar,5,4
"""You know, that bar chart thingy, the one with the 'Major Genre' and the average of 'Worldwide Gross'.""",Colloquial-Standard,Implicit-Explicit,query,movies,bar,1,1
"""I think this bar chart is showing us the average worldwide earnings for different movie genres.""",Non-technical-Technical,Subjective-Objective,query,movies,bar,1,1
"""This is a bar chart representation of the mean 'Worldwide Gross' for each 'Major Genre'.""",Colloquial-Standard,Non-technical-Technical,query,movies,bar,5,1
"""This bar chart represents the mean 'Worldwide Gross' for each 'Major Genre'.""",Non-technical-Technical,Implicit-Explicit,query,movies,bar,3,5
"So, what's the average global take for each genre, you think?",Colloquial-Standard,Implicit-Explicit,question,movies,bar,1,2
"I'm curious, what do you suppose is the average worldwide gross for each major genre?",Colloquial-Standard,Subjective-Objective,question,movies,bar,1,5
Please provide the mean worldwide gross for each major film genre.,Non-technical-Technical,Subjective-Objective,question,movies,bar,4,3
Can you tell me the average global earnings for each main type of movie?,Colloquial-Standard,Non-technical-Technical,question,movies,bar,1,2
Could you provide the average global earnings for each major film genre? It appears that some genres may perform better than others.,Non-technical-Technical,Subjective-Objective,question,movies,bar,2,2
What's the average worldwide earnings for each main movie genre?,Colloquial-Standard,Non-technical-Technical,question,movies,bar,2,3
What is the average global earnings for each main type of movie?,Colloquial-Standard,Non-technical-Technical,question,movies,bar,1,5
What are the average global earnings for each major film genre?,Non-technical-Technical,Subjective-Objective,question,movies,bar,3,2
I instruct you to create a point chart with 'IMDB Rating' on the x-axis and 'Rotten Tomatoes Rating' on the y-axis. This will provide a factual comparison of the ratings.,Colloquial-Standard,Subjective-Objective,command,movies,scatter,5,3
Construct a graph with 'IMDB Rating' as the horizontal variable and 'Rotten Tomatoes Rating' as the vertical variable.,Non-technical-Technical,Subjective-Objective,command,movies,scatter,5,1
Construct a Cartesian coordinate system with 'IMDB Rating' as the x-coordinate and 'Rotten Tomatoes Rating' as the y-coordinate.,Non-technical-Technical,Subjective-Objective,command,movies,scatter,5,4
I propose creating a point chart with 'IMDB Rating' on the x-axis and 'Rotten Tomatoes Rating' on the y-axis. I believe it would be quite informative.,Colloquial-Standard,Subjective-Objective,command,movies,scatter,2,3
A point chart should be instantiated with 'IMDB Rating' on the x-axis and 'Rotten Tomatoes Rating' on the y-axis.,Non-technical-Technical,Subjective-Objective,command,movies,scatter,4,5
"""You know, a chart with IMDB on one side and Rotten Tomatoes on the other would be cool.""",Colloquial-Standard,Implicit-Explicit,command,movies,scatter,2,1
It is necessary to have a chart with 'IMDB Rating' and 'Rotten Tomatoes Rating'. Could you create it?,Subjective-Objective,Implicit-Explicit,command,movies,scatter,3,5
A chart with 'IMDB Rating' and 'Rotten Tomatoes Rating' is needed.,Subjective-Objective,Implicit-Explicit,command,movies,scatter,1,5
"""Could you create a chart with IMDB ratings on the x-axis and Rotten Tomatoes ratings on the y-axis?""",Colloquial-Standard,Implicit-Explicit,command,movies,scatter,4,1
You know what you should do? Draw up a dot chart with 'IMDB Rating' on the side-to-side bit and 'Rotten Tomatoes Rating' on the up-and-down bit. I think it'll be really useful.,Colloquial-Standard,Subjective-Objective,command,movies,scatter,2,1
I think it would be cool to have a chart with 'IMDB Rating' and 'Rotten Tomatoes Rating'. Can you figure out how to do that?,Subjective-Objective,Implicit-Explicit,command,movies,scatter,2,1
Construct a dot chart. Position 'IMDB Rating' on the side-to-side bit and 'Rotten Tomatoes Rating' on the up-and-down bit. This will provide an unbiased comparison of the ratings.,Colloquial-Standard,Subjective-Objective,command,movies,scatter,5,1
"""It might be helpful to have a chart with IMDB and Rotten Tomatoes ratings.""",Colloquial-Standard,Implicit-Explicit,command,movies,scatter,1,3
You know those movie ratings from IMDB and Rotten Tomatoes? Can you put them on a simple graph?,Non-technical-Technical,Implicit-Explicit,command,movies,scatter,2,1
It is imperative to generate a scatter diagram with 'IMDB Rating' as the abscissa and 'Rotten Tomatoes Rating' as the ordinate.,Colloquial-Standard,Non-technical-Technical,command,movies,scatter,4,4
Construct a graph. IMDB ratings should be on one axis and Rotten Tomatoes ratings on the other.,Non-technical-Technical,Implicit-Explicit,command,movies,scatter,5,1
You need to create a chart with IMDB ratings on the horizontal line and Rotten Tomatoes ratings on the vertical line.,Colloquial-Standard,Non-technical-Technical,command,movies,scatter,1,3
It is crucial to produce a Cartesian plot with 'IMDB Rating' as the x-variable and 'Rotten Tomatoes Rating' as the y-variable.,Colloquial-Standard,Non-technical-Technical,command,movies,scatter,5,4
Please make a graph. Use the movie ratings from IMDB for one axis and the ones from Rotten Tomatoes for the other.,Non-technical-Technical,Implicit-Explicit,command,movies,scatter,3,1
The scattergram represents 'IMDB Rating' on the abscissa and 'Rotten Tomatoes Rating' on the ordinate.,Non-technical-Technical,Subjective-Objective,query,movies,scatter,3,5
The scattergram plots 'IMDB Rating' on the abscissa and 'Rotten Tomatoes Rating' on the ordinate.,Non-technical-Technical,Subjective-Objective,query,movies,scatter,5,5
"It seems like there's a chart with movie ratings, right?",Subjective-Objective,Implicit-Explicit,query,movies,scatter,1,2
It's a scatter diagram with IMDB ratings on the x-coordinate and Rotten Tomatoes ratings on the y-coordinate.,Colloquial-Standard,Non-technical-Technical,query,movies,scatter,3,1
This scatter plot has 'IMDB Rating' on the x-axis and 'Rotten Tomatoes Rating' on the y-axis.,Non-technical-Technical,Implicit-Explicit,query,movies,scatter,4,4
"This chart here, it's got IMDB ratings on the x-axis and Rotten Tomatoes ratings on the y-axis. Just my personal view.",Colloquial-Standard,Subjective-Objective,query,movies,scatter,1,2
This chart explicitly presents 'IMDB Rating' on the x-axis and 'Rotten Tomatoes Rating' on the y-axis.,Subjective-Objective,Implicit-Explicit,query,movies,scatter,5,3
"In this graphical representation, IMDB's on the x, Rotten Tomatoes on the y.",Colloquial-Standard,Implicit-Explicit,query,movies,scatter,1,5
This is a plot with 'IMDB Rating' on the x-axis and 'Rotten Tomatoes Rating' on the y-axis.,Non-technical-Technical,Implicit-Explicit,query,movies,scatter,5,3
"This graph, it's got IMDB ratings on the x-axis and Rotten Tomatoes ratings on the y-axis. That's the unbiased information.",Colloquial-Standard,Subjective-Objective,query,movies,scatter,4,3
"I feel like the 'IMDB Rating' and the 'Rotten Tomatoes Rating' might not be the same on a point chart, you know?",Subjective-Objective,Implicit-Explicit,question,movies,scatter,1,1
Can you tell how the movie ratings from IMDB and Rotten Tomatoes compare on a simple chart?,Non-technical-Technical,Implicit-Explicit,question,movies,scatter,2,1
What is the comparison of movie ratings from IMDB and Rotten Tomatoes on a simple chart?,Non-technical-Technical,Subjective-Objective,question,movies,scatter,5,1
A line chart with 'Release Year' on the x-axis and the mean of 'AVG (Production Budget)' on the y-axis would be a good representation. Can you make this chart?,Subjective-Objective,Implicit-Explicit,command,movies,line,4,4
Instantiate a line chart with 'Release Year' on the x-axis and the mean of 'AVG (Production Budget)' on the y-axis.,Non-technical-Technical,Subjective-Objective,command,movies,line,3,5
Please create a line chart with years and average budget.,Non-technical-Technical,Implicit-Explicit,command,movies,line,3,3
It is essential to plot a line chart with the release year and the mean production budget.,Colloquial-Standard,Non-technical-Technical,command,movies,line,3,4
You are tasked to generate a line chart with 'Release Year' and the arithmetic mean of 'AVG (Production Budget)'.,Colloquial-Standard,Non-technical-Technical,command,movies,line,5,2
"""It is recommended to create a line chart with 'Release Year' on the x-axis and the mean of 'AVG (Production Budget)' on the y-axis.""",Colloquial-Standard,Subjective-Objective,command,movies,line,4,4
"""Hey, can you whip up a line chart? You know, with the 'Release Year' on the bottom and the average of the 'Production Budget' up the side?""",Colloquial-Standard,Implicit-Explicit,command,movies,line,1,1
A line chart should be created with the release year and the average production budget.,Colloquial-Standard,Non-technical-Technical,command,movies,line,2,3
Consider creating a line chart with 'Release Year' on the x-axis and the mean of 'AVG (Production Budget)' on the y-axis.,Subjective-Objective,Implicit-Explicit,command,movies,line,1,4
Please create a graph with 'Release Year' on the x-axis and the mean of 'Production Budget' on the y-axis.,Non-technical-Technical,Implicit-Explicit,command,movies,line,5,2
"It's a line chart, maybe showing the average production budget over the years.",Subjective-Objective,Implicit-Explicit,query,movies,line,1,3
I feel like this line chart is depicting the mean of the production budget over the years.,Non-technical-Technical,Subjective-Objective,query,movies,line,1,3
This is a graph showing the average budget over the years.,Colloquial-Standard,Non-technical-Technical,query,movies,line,2,2
This is a line chart representing the mean of the 'AVG (Production Budget)' over the 'Release Year'.,Colloquial-Standard,Non-technical-Technical,query,movies,line,5,2
"""The line chart here represents the average production budget each year.""",Colloquial-Standard,Subjective-Objective,query,movies,line,4,2
It's a line chart showing the change in the mean production budget over time.,Non-technical-Technical,Implicit-Explicit,query,movies,line,2,3
It's a simple graph showing the average budget over the years.,Non-technical-Technical,Implicit-Explicit,query,movies,line,1,1
It's a line chart that clearly shows the average production budget by release year.,Subjective-Objective,Implicit-Explicit,query,movies,line,4,2
It's a line graph showing the change in average budget over time.,Non-technical-Technical,Implicit-Explicit,query,movies,line,2,2
"It's a line chart, explicitly showing the average production budget by release year.",Subjective-Objective,Implicit-Explicit,query,movies,line,5,3
How do you perceive the mean of the production budget to change over the release year?,Non-technical-Technical,Subjective-Objective,question,movies,line,1,3
Could you inform me how the mean of the 'AVG (Production Budget)' evolves over the course of the 'Release Year'?,Colloquial-Standard,Non-technical-Technical,question,movies,line,5,4
Clearly explain how the mean of the 'AVG (Production Budget)' changes over time.,Non-technical-Technical,Implicit-Explicit,question,movies,line,5,4
Could you clarify how the average production budget fluctuates over the release years?,Colloquial-Standard,Non-technical-Technical,question,movies,line,3,2
Could you inform me how the average budget changes over time?,Colloquial-Standard,Non-technical-Technical,question,movies,line,1,4
"Can you whip up a bar chart showing how much dough, on average, each type of creative project costs? And can you sort it by the content rating? Just my two cents, but I think it'd be pretty cool to see.",Colloquial-Standard,Subjective-Objective,command,movies,groupedBar,1,1
"Please create a bar chart that shows the average production budget for each creative type, grouped by content rating.",Colloquial-Standard,Non-technical-Technical,command,movies,groupedBar,3,3
"It is recommended to create a bar chart that shows the average production budget for each creative type, grouped by content rating.",Subjective-Objective,Implicit-Explicit,command,movies,groupedBar,2,4
"A bar chart needs to be created that clearly shows the average production budget for each creative type, grouped by content rating.",Subjective-Objective,Implicit-Explicit,command,movies,groupedBar,4,3
"Generate a graph illustrating the mean production expenditure for each creative category, classified by content rating.",Non-technical-Technical,Subjective-Objective,command,movies,groupedBar,5,1
"Could you create a bar chart? It should represent the average budget for each creative type, grouped by content rating.",Colloquial-Standard,Implicit-Explicit,command,movies,groupedBar,2,5
"Can you construct a bar chart that illustrates the mean production budget for each creative type, categorized by content rating?",Colloquial-Standard,Non-technical-Technical,command,movies,groupedBar,4,2
"We must create a bar chart that explicitly shows the average production budget for each creative type, grouped by content rating.",Subjective-Objective,Implicit-Explicit,command,movies,groupedBar,5,2
"Construct a bar chart representing the mean production expenditure for each creative category, classified by content rating.",Non-technical-Technical,Subjective-Objective,command,movies,groupedBar,5,4
"We're working out the mean production budget, considering the creative type and content rating.",Non-technical-Technical,Implicit-Explicit,query,movies,groupedBar,2,4
"What is the mean value of the 'Production Budget' variable, considering the 'Creative Type' and 'Content Rating' variables?",Colloquial-Standard,Non-technical-Technical,query,movies,groupedBar,5,3
"""The average production budget, but it's divided by the type of story and the rating.""",Colloquial-Standard,Implicit-Explicit,query,movies,groupedBar,2,3
"""The mean production budget, classified by creative type and content rating.""",Colloquial-Standard,Implicit-Explicit,query,movies,groupedBar,5,3
We're discussing the mean production budget as per the creative type and content rating.,Non-technical-Technical,Subjective-Objective,query,movies,groupedBar,3,4
"Kindly provide the average production budget, considering the creative type and content rating.",Colloquial-Standard,Non-technical-Technical,query,movies,groupedBar,2,5
"What's the mean production budget for each creative type, categorized by content rating?",Non-technical-Technical,Implicit-Explicit,question,movies,groupedBar,3,3
"What is the average production budget for each creative type, sorted by content rating?",Non-technical-Technical,Implicit-Explicit,question,movies,groupedBar,5,4
"Could you provide the average production budget for each creative type, categorized by content rating?",Colloquial-Standard,Implicit-Explicit,question,movies,groupedBar,5,4
"Can you tell me how much is typically spent on each type of movie, categorized by its rating?",Non-technical-Technical,Subjective-Objective,question,movies,groupedBar,3,1
Kindly create a bar chart with 'Major Genre' on the x-axis and the sum of 'Worldwide Gross' on the y-axis.,Colloquial-Standard,Subjective-Objective,command,movies,stackedBar,5,3
It is mandatory to construct a bar chart with the primary genre on the x-axis and the aggregate of global earnings on the y-axis.,Colloquial-Standard,Non-technical-Technical,command,movies,stackedBar,3,5
A bar chart must be fabricated with the predominant genre on the x-coordinate and the summation of worldwide gross revenue on the y-coordinate.,Colloquial-Standard,Non-technical-Technical,command,movies,stackedBar,5,3
"""Please generate a bar chart. 'Major Genre' on the x-axis, sum of 'Worldwide Gross' on the y-axis.""",Colloquial-Standard,Implicit-Explicit,command,movies,stackedBar,4,4
It is necessary to create a bar chart with 'Major Genre' on the x-axis and the sum of 'Worldwide Gross' on the y-axis.,Subjective-Objective,Implicit-Explicit,command,movies,stackedBar,3,4
A bar diagram should be fabricated with 'Major Genre' on the abscissa and the summation of 'Worldwide Gross' on the ordinate.,Non-technical-Technical,Subjective-Objective,command,movies,stackedBar,4,5
We should consider creating a bar chart with 'Major Genre' on the x-axis and the sum of 'Worldwide Gross' on the y-axis.,Subjective-Objective,Implicit-Explicit,command,movies,stackedBar,3,2
It's a bar chart that visualizes the summation of worldwide gross for each major genre.,Colloquial-Standard,Non-technical-Technical,query,movies,stackedBar,4,1
This bar chart clearly shows the sum of 'Worldwide Gross' for each 'Major Genre'.,Non-technical-Technical,Implicit-Explicit,query,movies,stackedBar,4,3
"It's a chart, right? With the big genres and their total worldwide earnings.",Colloquial-Standard,Implicit-Explicit,query,movies,stackedBar,1,2
This is a bar chart that visualizes the summation of worldwide gross for each major genre.,Colloquial-Standard,Non-technical-Technical,query,movies,stackedBar,4,2
This is a chart showing the total earnings of different movie genres around the world.,Non-technical-Technical,Subjective-Objective,query,movies,stackedBar,1,2
This bar chart definitively shows the total worldwide gross for each major genre.,Subjective-Objective,Implicit-Explicit,query,movies,stackedBar,5,4
It's a graphical representation of the major genres and their total worldwide earnings.,Colloquial-Standard,Implicit-Explicit,query,movies,stackedBar,1,4
This bar chart unequivocally shows the total worldwide gross for each major genre.,Subjective-Objective,Implicit-Explicit,query,movies,stackedBar,5,5
The bar chart displays 'Major Genre' and the sum of 'Worldwide Gross'.,Colloquial-Standard,Subjective-Objective,query,movies,stackedBar,3,3
This bar chart clearly shows the aggregate 'Worldwide Gross' for each 'Major Genre'.,Non-technical-Technical,Implicit-Explicit,query,movies,stackedBar,4,4
This bar chart is presenting 'Major Genre' and the sum of 'Worldwide Gross'.,Colloquial-Standard,Subjective-Objective,query,movies,stackedBar,4,2
Could you provide the total worldwide gross for each major genre?,Subjective-Objective,Implicit-Explicit,question,movies,stackedBar,4,2
Any idea about the total cash each major movie genre made worldwide?,Colloquial-Standard,Implicit-Explicit,question,movies,stackedBar,1,2
I am inquiring about the total global gross for each primary genre in the film industry.,Colloquial-Standard,Non-technical-Technical,question,movies,stackedBar,4,5
"I speculate, what's the cumulative worldwide gross for each predominant film genre?",Non-technical-Technical,Subjective-Objective,question,movies,stackedBar,1,4
"The task is to construct a point chart with the production budget on the x-axis and the worldwide gross on the y-axis, color-coded by major genre.",Non-technical-Technical,Subjective-Objective,command,movies,scatterColor,4,2
"A chart should be created with the production budget on one axis and the worldwide gross on the other, color-coded by genre.",Subjective-Objective,Implicit-Explicit,command,movies,scatterColor,4,4
"Generate a point diagram with the production budget on the abscissa and the worldwide gross on the ordinate, with the major genre represented by chromatic differentiation.",Colloquial-Standard,Non-technical-Technical,command,movies,scatterColor,5,1
"Create a chart with the production budget on the x-axis and the worldwide gross on the y-axis, color-coded by genre.",Subjective-Objective,Implicit-Explicit,command,movies,scatterColor,5,2
"We need a point chart. 'Production Budget' on the x-axis, 'Worldwide Gross' on the y-axis. And color it by 'Major Genre'.",Colloquial-Standard,Implicit-Explicit,command,movies,scatterColor,2,4
"Please create a point chart with 'Production Budget' on the x-axis and 'Worldwide Gross' on the y-axis, color-coded by 'Major Genre'.",Non-technical-Technical,Implicit-Explicit,command,movies,scatterColor,3,4
"Construct a chart with dots where the horizontal line represents the cost of making the movie and the vertical line represents the worldwide earnings, with different colors representing different movie genres.",Non-technical-Technical,Subjective-Objective,command,movies,scatterColor,4,1
