commands,axes,axes2,ptypes,dnames,vids,scores,scores2
A bar chart with 'Number of Cylinders' on the x-axis and the average 'Miles Per Gallon' on the y-axis would be appropriate.,Subjective-Objective,Implicit-Explicit,command,cars,bar,5,3
"A bar chart, cylinders on one axis, miles per gallon on the other.",Subjective-Objective,Implicit-Explicit,command,cars,bar,3,4
The bar chart presents the average miles per gallon for cars with different numbers of cylinders.,Colloquial-Standard,Non-technical-Technical,query,cars,bar,1,3
This chart shows the average miles per gallon for cars with different engine specifications.,Non-technical-Technical,Implicit-Explicit,query,cars,bar,3,4
"The bar chart delineates the average fuel efficiency for automobiles, categorized by the number of cylinders.",Colloquial-Standard,Non-technical-Technical,query,cars,bar,2,5
"""This bar chart precisely illustrates the average miles per gallon for each number of cylinders.""",Colloquial-Standard,Implicit-Explicit,query,cars,bar,5,5
This is a bar chart that illustrates the relationship between a vehicle's number of cylinders and its average miles per gallon.,Colloquial-Standard,Non-technical-Technical,query,cars,bar,3,2
The bar graph depicts the average fuel consumption rate in miles per gallon for vehicles with varying cylinder counts.,Colloquial-Standard,Non-technical-Technical,query,cars,bar,5,4
"""This bar chart represents the correlation between the number of cylinders in an automobile and its average fuel economy.""",Non-technical-Technical,Subjective-Objective,query,cars,bar,3,5
It's a chart showing the relationship between a car's cylinders and its fuel efficiency.,Non-technical-Technical,Implicit-Explicit,query,cars,bar,2,2
This chart shows the average miles per gallon for cars with different numbers of cylinders.,Non-technical-Technical,Implicit-Explicit,query,cars,bar,3,2
"""This bar chart, it's showing the number of cylinders and the average miles per gallon. In my opinion, it's quite informative.""",Colloquial-Standard,Subjective-Objective,query,cars,bar,2,3
"This bar chart could be about the average miles per gallon for different numbers of cylinders, couldn't it?",Subjective-Objective,Implicit-Explicit,query,cars,bar,1,3
"""You see the chart with the cylinder count and the average miles per gallon?""",Colloquial-Standard,Implicit-Explicit,query,cars,bar,1,3
This chart shows the average miles per gallon for vehicles with different engine cylinder counts.,Non-technical-Technical,Implicit-Explicit,query,cars,bar,3,5
Can you show me the mean MPG for each cylinder count in a bar chart?,Colloquial-Standard,Non-technical-Technical,question,cars,bar,3,1
Can you show me a bar chart representation that signifies the average 'Miles Per Gallon' for different 'Number of Cylinders'?,Non-technical-Technical,Implicit-Explicit,question,cars,bar,3,5
"In my view, a bar chart of the average MPG for each cylinder count would be beneficial.",Non-technical-Technical,Subjective-Objective,question,cars,bar,2,4
I need a graph that clearly shows the fuel efficiency for each type of car.,Non-technical-Technical,Implicit-Explicit,question,cars,bar,5,2
Could you display the average gas usage for each type of car in a bar chart?,Colloquial-Standard,Non-technical-Technical,question,cars,bar,1,2
I think it would be beneficial to see a bar chart of the average miles per gallon for each number of cylinders.,Colloquial-Standard,Subjective-Objective,question,cars,bar,2,4
I request a bar chart representation of the average miles per gallon for each number of cylinders.,Colloquial-Standard,Subjective-Objective,question,cars,bar,5,5
Please provide a bar chart showing the average miles per gallon for each number of cylinders.,Colloquial-Standard,Subjective-Objective,question,cars,bar,4,4
"Construct a scatter plot with ""Horsepower"" on the abscissa and ""Acceleration"" on the ordinate.",Non-technical-Technical,Subjective-Objective,command,cars,scatter,3,5
"I suggest we fabricate a point chart with ""Horsepower"" on the x-axis and ""Acceleration"" on the y-axis.",Non-technical-Technical,Subjective-Objective,command,cars,scatter,1,4
"Create a point chart with ""Horsepower"" on the x-axis and ""Acceleration"" on the y-axis.",Subjective-Objective,Implicit-Explicit,command,cars,scatter,5,5
"I think a chart with ""Horsepower"" and ""Acceleration"" would be quite revealing.",Subjective-Objective,Implicit-Explicit,command,cars,scatter,2,1
Please create a graph. The x-axis should represent horsepower and the y-axis should represent acceleration.,Non-technical-Technical,Implicit-Explicit,command,cars,scatter,4,3
Please create a point chart. The x-axis should represent horsepower and the y-axis should represent acceleration.,Non-technical-Technical,Implicit-Explicit,command,cars,scatter,5,4
"Make a simple graph with ""Horsepower"" on the bottom and ""Acceleration"" on the side. I think it'll look pretty cool.",Non-technical-Technical,Subjective-Objective,command,cars,scatter,1,1
"I feel like it would be interesting to see a chart with ""Horsepower"" and ""Acceleration"", don't you think?",Subjective-Objective,Implicit-Explicit,command,cars,scatter,1,1
"It would be useful to create a point chart with ""Horsepower"" on the x-axis and ""Acceleration"" on the y-axis.",Colloquial-Standard,Subjective-Objective,command,cars,scatter,3,3
"Construct a scatter plot with ""Horsepower"" as the independent variable and ""Acceleration"" as the dependent variable.",Colloquial-Standard,Non-technical-Technical,command,cars,scatter,4,1
"You know, it's like a graph with horsepower on the bottom and acceleration on the side.",Colloquial-Standard,Subjective-Objective,query,cars,scatter,2,1
"This is a graph, with horsepower on the x-axis and acceleration on the y-axis.",Colloquial-Standard,Subjective-Objective,query,cars,scatter,3,2
The point chart we are examining has horsepower plotted on the x-axis and acceleration on the y-axis.,Colloquial-Standard,Implicit-Explicit,query,cars,scatter,5,1
"This is a graph, with horsepower on the x-axis and acceleration on the y-axis.",Colloquial-Standard,Subjective-Objective,query,cars,scatter,2,3
It's a scatter diagram with horsepower on the x-axis and acceleration on the y-axis.,Colloquial-Standard,Non-technical-Technical,query,cars,scatter,3,1
Chart with horsepower and acceleration.,Subjective-Objective,Implicit-Explicit,query,cars,scatter,2,5
"We're looking at a point chart, power on one axis, speed on the other.",Non-technical-Technical,Implicit-Explicit,query,cars,scatter,1,3
The point chart we are discussing has horsepower plotted on the x-axis and acceleration on the y-axis.,Colloquial-Standard,Implicit-Explicit,query,cars,scatter,5,2
"A point chart is required, with horsepower on the x-axis and acceleration on the y-axis.",Subjective-Objective,Implicit-Explicit,query,cars,scatter,5,3
This point chart has horsepower on one axis and acceleration on the other.,Non-technical-Technical,Implicit-Explicit,query,cars,scatter,2,3
"We have a point chart, horsepower's on the x, acceleration's on the y.",Colloquial-Standard,Implicit-Explicit,query,cars,scatter,1,4
"The diagram is a graph, with the x-axis denoting horsepower and the y-axis denoting acceleration.",Colloquial-Standard,Subjective-Objective,query,cars,scatter,5,1
Are you aware of the graphical representation of horsepower versus acceleration?,Colloquial-Standard,Implicit-Explicit,question,cars,scatter,1,5
Please provide a graphical representation of the correlation between acceleration and horsepower.,Non-technical-Technical,Subjective-Objective,question,cars,scatter,5,2
How does the graph illustrating horsepower in comparison to acceleration appear?,Colloquial-Standard,Implicit-Explicit,question,cars,scatter,3,5
Could you describe the graph that compares horsepower and acceleration?,Colloquial-Standard,Implicit-Explicit,question,cars,scatter,4,2
"I'd like to see the ""Horsepower"" versus ""Acceleration"" graph. Can you provide it?",Subjective-Objective,Implicit-Explicit,question,cars,scatter,3,2
"How's that graph of horsepower and acceleration looking, eh?",Colloquial-Standard,Subjective-Objective,question,cars,scatter,1,1
"Can you describe the ""Horsepower"" versus ""Acceleration"" graph?",Subjective-Objective,Implicit-Explicit,question,cars,scatter,2,5
"I'm curious, what does the picture look like when we compare a car's speed to its power?",Non-technical-Technical,Subjective-Objective,question,cars,scatter,2,1
Could you please provide a clear description of the graph that represents the relationship between horsepower and acceleration?,Colloquial-Standard,Implicit-Explicit,question,cars,scatter,5,1
The task is to generate a line chart with 'Year' as the abscissa and the arithmetic mean of 'AVG (Weight)' as the ordinate.,Non-technical-Technical,Subjective-Objective,command,cars,line,3,5
Can you construct a line chart with the temporal variable on the abscissa and the arithmetic mean of the weight variable on the ordinate?,Non-technical-Technical,Implicit-Explicit,command,cars,line,2,5
"Line chart is necessary. 'Year' on the x-axis, mean of 'AVG (Weight)' on the y-axis.",Subjective-Objective,Implicit-Explicit,command,cars,line,4,5
The task is to create a line graph with the years on the x-axis and the average weight on the y-axis.,Non-technical-Technical,Subjective-Objective,command,cars,line,3,2
We should consider creating a line chart. 'Year' could be on the x-axis and the mean of 'AVG (Weight)' on the y-axis.,Subjective-Objective,Implicit-Explicit,command,cars,line,3,2
A line graph is needed. 'Year' should be on the x-axis and the mean of 'AVG (Weight)' on the y-axis.,Colloquial-Standard,Subjective-Objective,command,cars,line,5,1
It would be good to create a line chart with 'Year' on the x-axis and the average weight on the y-axis.,Colloquial-Standard,Subjective-Objective,command,cars,line,3,2
"""Could we create a line chart? 'Year' on the x-axis, average weight on the y-axis.""",Colloquial-Standard,Implicit-Explicit,command,cars,line,4,3
It is suggested to construct a line graph with 'Year' as the x-axis and the mean of 'AVG (Weight)' as the y-axis.,Colloquial-Standard,Non-technical-Technical,command,cars,line,3,5
I suggest creating a line chart with 'Year' on the x-axis and the mean of 'AVG (Weight)' on the y-axis.,Colloquial-Standard,Subjective-Objective,command,cars,line,2,3
"""Consider a line chart, 'Year' on the x-axis, average weight on the y-axis.""",Colloquial-Standard,Implicit-Explicit,command,cars,line,1,3
"""We need to create a line chart, 'Year' on the x-axis, average weight on the y-axis.""",Colloquial-Standard,Implicit-Explicit,command,cars,line,3,4
It is advised to create a line chart with 'Year' on the x-axis and the average weight on the y-axis.,Colloquial-Standard,Non-technical-Technical,command,cars,line,1,5
I would recommend plotting a line chart with 'Year' on the x-axis and the mean of 'AVG (Weight)' on the y-axis.,Colloquial-Standard,Non-technical-Technical,command,cars,line,2,4
This line chart represents the mean of AVG (Weight) for each year.,Non-technical-Technical,Implicit-Explicit,query,cars,line,3,4
This line chart represents the mean of AVG (Weight) for each year.,Non-technical-Technical,Implicit-Explicit,query,cars,line,3,5
"""This line chart represents the average weight for each year.""",Colloquial-Standard,Implicit-Explicit,query,cars,line,3,5
This line chart represents the years and the mean of the average weight.,Colloquial-Standard,Subjective-Objective,query,cars,line,5,1
"""This line chart accurately represents the mean of the average weight per annum.""",Colloquial-Standard,Implicit-Explicit,query,cars,line,5,2
This line chart is showing the average weight over the years.,Subjective-Objective,Implicit-Explicit,query,cars,line,4,5
This graph represents the average weight over the years.,Colloquial-Standard,Non-technical-Technical,query,cars,line,1,4
This is a line chart showing the average weight over the years.,Subjective-Objective,Implicit-Explicit,query,cars,line,2,5
I think this is a line chart depicting the annual mean of average weight.,Non-technical-Technical,Subjective-Objective,query,cars,line,1,4
The line chart here represents the years and the mean of the average weight.,Colloquial-Standard,Subjective-Objective,query,cars,line,5,2
It's a graph showing how weight changes over time.,Non-technical-Technical,Implicit-Explicit,query,cars,line,1,1
What does the line chart of the mean weight over the years suggest?,Colloquial-Standard,Subjective-Objective,question,cars,line,4,2
What is your interpretation of the line chart of the mean of 'AVG (Weight)' over 'Year'?,Colloquial-Standard,Subjective-Objective,question,cars,line,2,5
It seems the line chart is showing the mean of 'AVG (Weight)' over 'Year'.,Subjective-Objective,Implicit-Explicit,question,cars,line,3,3
What's the line chart of the mean of 'AVG (Weight)' over 'Year' trying to convey?,Non-technical-Technical,Implicit-Explicit,question,cars,line,2,5
What does the line chart of the mean of 'AVG (Weight)' over 'Year' signify?,Colloquial-Standard,Subjective-Objective,question,cars,line,4,5
What is the line chart showing about the mean weight over the years?,Colloquial-Standard,Non-technical-Technical,question,cars,line,3,2
Could the line chart be showing the mean of 'AVG (Weight)' over 'Year'?,Subjective-Objective,Implicit-Explicit,question,cars,line,2,5
"I require you to create a bar chart that displays the average acceleration of cars, categorized by their origin and number of cylinders.",Colloquial-Standard,Implicit-Explicit,command,cars,groupedBar,5,5
"I think it would be a good idea to create a bar chart that shows the average acceleration of cars, considering their origin and number of cylinders.",Colloquial-Standard,Subjective-Objective,command,cars,groupedBar,2,2
"Could you construct a bar chart that shows the mean acceleration of cars, taking into account their origin and cylinder count?",Non-technical-Technical,Implicit-Explicit,command,cars,groupedBar,2,3
"Generate a bar graph that explicitly illustrates the average acceleration of vehicles, categorized by their origin and number of cylinders.",Non-technical-Technical,Implicit-Explicit,command,cars,groupedBar,5,4
"A bar chart is needed to display the average acceleration of cars, considering their origin and number of cylinders.",Subjective-Objective,Implicit-Explicit,command,cars,groupedBar,3,5
"I would like you to create a bar chart that displays the average acceleration of cars, categorized by their origin and number of cylinders.",Colloquial-Standard,Implicit-Explicit,command,cars,groupedBar,5,2
"I need a bar graph that directly illustrates the average acceleration of vehicles, categorized by their origin and number of cylinders.",Non-technical-Technical,Implicit-Explicit,command,cars,groupedBar,4,4
"I believe it would be advantageous to construct a bar graph that delineates the average acceleration of vehicles, contingent on their origin and number of cylinders.",Non-technical-Technical,Subjective-Objective,command,cars,groupedBar,1,4
"One should formulate a bar chart that depicts the average rate of change in velocity of cars, based on their geographical origin and number of cylinders.",Colloquial-Standard,Non-technical-Technical,command,cars,groupedBar,4,4
"A bar chart should be created to demonstrate the average acceleration of cars, taking into account their origin and number of cylinders.",Colloquial-Standard,Subjective-Objective,command,cars,groupedBar,5,5
"Can you make a bar graph? It should show the average speed-up of cars, based on where they're from and how many cylinders they have.",Colloquial-Standard,Implicit-Explicit,command,cars,groupedBar,3,1
"Could we construct a bar graph that quantifies the mean acceleration of automobiles, contingent upon their geographical provenance and cylinder quantity? It might reveal some intriguing trends.",Non-technical-Technical,Subjective-Objective,command,cars,groupedBar,2,5
"Let's create a bar chart that displays the average acceleration of cars, based on their origin and number of cylinders.",Subjective-Objective,Implicit-Explicit,command,cars,groupedBar,4,2
"I need you to create a graph that clearly shows the average speed of cars, based on where they were made and the number of cylinders they have.",Non-technical-Technical,Implicit-Explicit,command,cars,groupedBar,4,1
"Let's make a simple graph that shows the average speed increase of cars from different places, based on their number of cylinders.",Non-technical-Technical,Subjective-Objective,command,cars,groupedBar,3,1
"Please generate a bar graph that illustrates the average acceleration of cars, differentiated by their origin and cylinder count.",Non-technical-Technical,Subjective-Objective,command,cars,groupedBar,4,3
"I feel like you should make a bar chart showing the average acceleration of cars, based on where they're from and how many cylinders they have.",Colloquial-Standard,Subjective-Objective,command,cars,groupedBar,1,3
"It is required to create a bar chart that displays the average acceleration of cars, taking into account their origin and number of cylinders.",Colloquial-Standard,Non-technical-Technical,command,cars,groupedBar,2,5
"A bar chart is needed, average car acceleration, origin, number of cylinders.",Colloquial-Standard,Implicit-Explicit,command,cars,groupedBar,1,4
"Could you make a bar graph that shows the average speed of cars, taking into account their origin and number of cylinders?",Non-technical-Technical,Implicit-Explicit,command,cars,groupedBar,2,2
"That bar chart, the car's speed, where it's made, and the cylinder count.",Colloquial-Standard,Implicit-Explicit,query,cars,groupedBar,1,2
"""The bar chart, the average acceleration, the origin of the car, and the number of cylinders are all factual.""",Colloquial-Standard,Subjective-Objective,query,cars,groupedBar,4,4
"I reckon the bar chart, the mean acceleration, the car's provenance, and the number of cylinders are all vital.",Non-technical-Technical,Subjective-Objective,query,cars,groupedBar,1,4
"The bar chart is about average acceleration, and it's related to the car's origin and the number of cylinders.",Subjective-Objective,Implicit-Explicit,query,cars,groupedBar,2,4
"The bar chart, the average acceleration, the car's origin, and the number of cylinders are all key factors.",Non-technical-Technical,Subjective-Objective,query,cars,groupedBar,5,3
"The histogram, the average acceleration, the vehicle's origin, and the number of cylinders are all essential.",Non-technical-Technical,Subjective-Objective,query,cars,groupedBar,3,5
"Considering where cars are made and their engine cylinders, can you figure out their typical speed gain?",Non-technical-Technical,Implicit-Explicit,question,cars,groupedBar,2,2
"When considering a vehicle's mean acceleration value, its geographical provenance and cylinder count are key factors.",Non-technical-Technical,Implicit-Explicit,question,cars,groupedBar,4,5
"Could you provide the average acceleration of vehicles, considering their origin and the number of cylinders they possess?",Colloquial-Standard,Non-technical-Technical,question,cars,groupedBar,3,5
"Make a bar graph with 'Cylinders' on the bottom and the number of things on the side, and color it by 'Origin'.",Colloquial-Standard,Non-technical-Technical,command,cars,stackedBar,1,1
"Construct a bar chart with 'Cylinders' as the horizontal component and the count of records as the vertical component, color-coded by 'Origin'.",Non-technical-Technical,Subjective-Objective,command,cars,stackedBar,5,3
Draw a picture with bars. The bars should represent 'Cylinders'. The number of bars should match the number of records. Use different colors for the bars based on 'Origin'.,Non-technical-Technical,Implicit-Explicit,command,cars,stackedBar,2,1
"Can you make a bar chart with 'Cylinders' on the x-axis, count of records on the y-axis, and color it by 'Origin'?",Colloquial-Standard,Implicit-Explicit,command,cars,stackedBar,3,1
"It is compulsory to fabricate a bar chart with 'Cylinders' on the x-coordinate and the quantification on the y-coordinate, and color it by 'Origin'.",Colloquial-Standard,Non-technical-Technical,command,cars,stackedBar,5,3
"I believe we should generate a bar chart with 'Cylinders' on the x-axis and the count of records on the y-axis, color-coded by 'Origin'.",Non-technical-Technical,Subjective-Objective,command,cars,stackedBar,1,3
"I propose the creation of a bar chart with 'Cylinders' on the x-axis and the count of records on the y-axis, color-coded by 'Origin'.",Colloquial-Standard,Subjective-Objective,command,cars,stackedBar,1,5
"It is necessary to generate a bar chart with 'Cylinders' on the x-axis and the count of records on the y-axis, and color it by 'Origin'.",Colloquial-Standard,Subjective-Objective,command,cars,stackedBar,4,4
You should make a bar diagram. Put 'Cylinders' on one axis and the count of records on the other. And color it based on 'Origin'.,Non-technical-Technical,Implicit-Explicit,command,cars,stackedBar,3,4
"Create a bar chart. 'Cylinders' on the x-axis, count of records on the y-axis, and color-coded by 'Origin'.",Subjective-Objective,Implicit-Explicit,command,cars,stackedBar,4,5
"You need to draw a bar graph with 'Cylinders' on the horizontal line and the tally on the vertical, and color it by 'Origin'.",Colloquial-Standard,Non-technical-Technical,command,cars,stackedBar,2,2
Make a bar picture. The bars should show 'Cylinders'. The number of bars should be the same as the number of records. The bars should be colored based on 'Origin'.,Non-technical-Technical,Implicit-Explicit,command,cars,stackedBar,3,1
"Draw a bar graph with 'Cylinders' on the horizontal line and the tally on the vertical, and color it by 'Origin'.",Colloquial-Standard,Non-technical-Technical,command,cars,stackedBar,2,1
"It is suitable to generate a bar chart with 'Cylinders' on the x-axis and the count of records on the y-axis, and color it by 'Origin'.",Colloquial-Standard,Subjective-Objective,command,cars,stackedBar,3,4
"Make a bar graph thingy with 'Cylinders' on the bottom and the number of things on the side, and color it by where it's from.",Colloquial-Standard,Subjective-Objective,command,cars,stackedBar,1,1
"This is a bar chart presenting the count of 'Cylinders', with colors representing their 'Origin'.",Colloquial-Standard,Non-technical-Technical,query,cars,stackedBar,2,3
"Here's a bar chart that displays the count of cylinders, with colors used to represent their origins.",Non-technical-Technical,Implicit-Explicit,query,cars,stackedBar,3,3
"A bar graph is presented, depicting the count of cylinders, with color differentiation for origin.",Non-technical-Technical,Subjective-Objective,query,cars,stackedBar,4,1
"This bar chart shows the count of cylinders, and the colors are based on their origins.",Non-technical-Technical,Subjective-Objective,query,cars,stackedBar,1,5
"Here is a bar chart that exhibits the quantitative distribution of 'Cylinders', with chromatic differentiation for 'Origin'.",Colloquial-Standard,Non-technical-Technical,query,cars,stackedBar,5,4
The bar chart here is about 'Cylinders' and their frequency. The color is representing 'Origin'.,Colloquial-Standard,Subjective-Objective,query,cars,stackedBar,3,4
"There is clearly a bar chart of 'Cylinders' by count of records, with color for 'Origin'.",Subjective-Objective,Implicit-Explicit,query,cars,stackedBar,4,5
"This bar chart represents the count of cylinders, with colors indicating their origins.",Non-technical-Technical,Implicit-Explicit,query,cars,stackedBar,2,3
"What is the enumeration of each 'Cylinders' category, differentiated by 'Origin'?",Colloquial-Standard,Non-technical-Technical,question,cars,stackedBar,5,1
"I'm considering, how many records do we have for each 'Cylinders' category, and does it change based on 'Origin'?",Colloquial-Standard,Subjective-Objective,question,cars,stackedBar,2,4
Could you tell me the number of each 'Cylinders' category and their 'Origin'?,Non-technical-Technical,Implicit-Explicit,question,cars,stackedBar,2,2
"There are different numbers of records for each 'Cylinders' category, differentiated by 'Origin'.",Subjective-Objective,Implicit-Explicit,question,cars,stackedBar,1,5
"A chart with ""Displacement"" and ""MPG"" would be beneficial. Colors should indicate ""Origin"".",Subjective-Objective,Implicit-Explicit,command,cars,scatterColor,3,3
"It would be advisable to draw up a point chart with ""Displacement"" on the x-axis and ""MPG"" on the y-axis, and color the points by ""Origin"".",Colloquial-Standard,Subjective-Objective,command,cars,scatterColor,4,2
Create a point chart. The x-axis should be displacement and the y-axis should be MPG. The color of the points should indicate the origin.,Non-technical-Technical,Implicit-Explicit,command,cars,scatterColor,4,4
Generate a point chart. The x-axis should be displacement and the y-axis should be MPG. The color of the points should indicate the origin.,Non-technical-Technical,Implicit-Explicit,command,cars,scatterColor,4,5
"We need a point chart. X-axis for displacement, y-axis for MPG. Points' color? That's the origin.",Non-technical-Technical,Implicit-Explicit,command,cars,scatterColor,1,4
"It is necessary to plot a graph with ""displacement"" on the x-axis and ""miles per gallon"" on the y-axis, and color the points based on the car's origin.",Colloquial-Standard,Non-technical-Technical,command,cars,scatterColor,3,4
Plot a point chart. The x-axis is displacement and the y-axis is MPG. The color of the points represents the origin.,Non-technical-Technical,Implicit-Explicit,command,cars,scatterColor,3,5
"I propose that it would be beneficial to generate a point chart with ""Displacement"" on the x-axis and ""MPG"" on the y-axis, and color the points based on ""Origin"".",Colloquial-Standard,Subjective-Objective,command,cars,scatterColor,2,5
