commands,axes,axes2,ptypes,dnames,vids,scores,scores2
It appears that the average earnings are affected by the delivery method and the customer group.,Non-technical-Technical,Subjective-Objective,query,superstore,groupedBar,2,2
The net income is associated with the freight method and the customer cohort.,Non-technical-Technical,Implicit-Explicit,query,superstore,groupedBar,3,5
The average profit is associated with the shipping method and customer segment.,Subjective-Objective,Implicit-Explicit,query,superstore,groupedBar,4,5
The median profit is impacted by the logistics method and the consumer segment.,Non-technical-Technical,Subjective-Objective,query,superstore,groupedBar,3,4
The average profit could be related to the shipping method and customer segment.,Subjective-Objective,Implicit-Explicit,query,superstore,groupedBar,2,3
Any idea about the profit from different shipping and customer types?,Colloquial-Standard,Implicit-Explicit,query,superstore,groupedBar,1,2
The average earnings for each delivery method and customer group should be determined.,Non-technical-Technical,Subjective-Objective,question,superstore,groupedBar,5,2
We should probably find out the average profit for each shipping method and customer segment.,Subjective-Objective,Implicit-Explicit,question,superstore,groupedBar,4,2
What do you think is the average profit for each shipping method and customer segment?,Colloquial-Standard,Subjective-Objective,question,superstore,groupedBar,1,2
"""Please create a bar chart. 'Region' should be on the x-axis and the sum of 'Profit' on the y-axis. Also, color it by 'Ship Status'.""",Colloquial-Standard,Implicit-Explicit,command,superstore,stackedBar,4,4
"Construct a bar diagram with 'Region' on the x-axis and the aggregate of 'Profit' on the y-axis, and color it according to 'Ship Status'.",Colloquial-Standard,Non-technical-Technical,command,superstore,stackedBar,3,1
Can you draw a picture with places on one side and the total money we made on the other? Use colors to show the shipping status.,Non-technical-Technical,Implicit-Explicit,command,superstore,stackedBar,2,1
"The directive is to create a bar chart with 'Region' on the x-axis and the sum of 'Profit' on the y-axis, colored by 'Ship Status'. This is the instruction.",Colloquial-Standard,Subjective-Objective,command,superstore,stackedBar,5,5
"The task is to generate a bar chart with 'Region' on the x-axis and the sum of 'Profit' on the y-axis, colored by 'Ship Status'.",Non-technical-Technical,Subjective-Objective,command,superstore,stackedBar,4,4
"Let's have a bar chart with regions and profits, and use colors for shipping statuses.",Non-technical-Technical,Implicit-Explicit,command,superstore,stackedBar,1,2
"""Please create a bar chart. 'Region' should be on the x-axis and the sum of 'Profit' on the y-axis. Also, color it by 'Ship Status'.""",Colloquial-Standard,Implicit-Explicit,command,superstore,stackedBar,4,5
"Create a bar chart with 'Region' on the x-axis and the sum of 'Profit' on the y-axis, colored by 'Ship Status'.",Subjective-Objective,Implicit-Explicit,command,superstore,stackedBar,5,5
"The task is to create a bar chart with regions and their corresponding profits, and color it according to the shipping status.",Non-technical-Technical,Subjective-Objective,command,superstore,stackedBar,4,2
"""Hey, can you whip up a bar chart for me? You know, with 'Region' on the bottom and the total 'Profit' up the side. Oh, and color it by 'Ship Status', okay?""",Colloquial-Standard,Implicit-Explicit,command,superstore,stackedBar,1,1
"One is compelled to construct a bar diagram with 'Region' on the x-axis and the aggregate of 'Profit' on the y-axis, and color it according to 'Ship Status'.",Colloquial-Standard,Non-technical-Technical,command,superstore,stackedBar,3,5
"Could you generate a bar chart with 'Region' and the aggregate of 'Profit', color-coded by 'Ship Status'?",Non-technical-Technical,Implicit-Explicit,command,superstore,stackedBar,2,4
"We need to create a bar chart with regions on the x-axis and profit on the y-axis, colored by ship status.",Subjective-Objective,Implicit-Explicit,command,superstore,stackedBar,4,3
"Please generate a bar chart with 'Region' as the independent variable and the sum of 'Profit' as the dependent variable, differentiated by 'Ship Status'.",Non-technical-Technical,Implicit-Explicit,command,superstore,stackedBar,3,5
"You are required to construct a bar diagram with 'Region' on the x-axis and the aggregate of 'Profit' on the y-axis, and color it according to 'Ship Status'.",Colloquial-Standard,Non-technical-Technical,command,superstore,stackedBar,3,2
"A bar chart showing regions and profits, with colors representing delivery status.",Non-technical-Technical,Implicit-Explicit,query,superstore,stackedBar,2,3
"This is a bar chart representing the aggregate profit per region, with the color coding indicating the status of shipment.",Colloquial-Standard,Non-technical-Technical,query,superstore,stackedBar,5,2
"We have a bar chart here. It's about regions and profits, and the colors are related to shipping.",Colloquial-Standard,Implicit-Explicit,query,superstore,stackedBar,1,3
"What's the pecuniary benefit for each geographical sector, bifurcated by shipping status?",Colloquial-Standard,Non-technical-Technical,question,superstore,stackedBar,5,1
"Make a dot chart, color it by 'Region', 'Sales' on the side, and 'Profit' up top, you know?",Colloquial-Standard,Implicit-Explicit,command,superstore,scatterColor,1,1
"I believe you should generate a point chart with 'Region' as color, 'Sales' on the x-axis, and 'Profit' on the y-axis.",Non-technical-Technical,Subjective-Objective,command,superstore,scatterColor,1,3
"Can you draw a picture with dots? Use colors for places, the money we made goes at the bottom, and the money we kept goes on the side.",Non-technical-Technical,Implicit-Explicit,command,superstore,scatterColor,2,1
"A point chart should be created, with 'Region' as color, 'Sales' on the x-axis, and 'Profit' on the y-axis.",Colloquial-Standard,Subjective-Objective,command,superstore,scatterColor,5,2
"We should create a point chart with 'Region' as color, 'Sales' on the x-axis, and 'Profit' on the y-axis.",Subjective-Objective,Implicit-Explicit,command,superstore,scatterColor,4,2
"Could you generate a scatter plot? 'Region' is denoted by color, 'Sales' is on the x-axis, and 'Profit' is on the y-axis.",Non-technical-Technical,Implicit-Explicit,command,superstore,scatterColor,2,4
"Let's make a chart with dots. Use colors for regions, sales on the horizontal line, and profit on the vertical line.",Non-technical-Technical,Implicit-Explicit,command,superstore,scatterColor,1,2
"Could you create a point chart? Use 'Region' for color, 'Sales' on the side, and 'Profit' up top.",Colloquial-Standard,Implicit-Explicit,command,superstore,scatterColor,3,2
"It is crucial to generate a point plot, with 'Region' as chromaticity, 'Sales' on the x-coordinate, and 'Profit' on the y-coordinate.",Colloquial-Standard,Non-technical-Technical,command,superstore,scatterColor,4,4
"I direct you to create a point chart. Use 'Region' for color, 'Sales' on the x-axis, and 'Profit' on the y-axis.",Colloquial-Standard,Implicit-Explicit,command,superstore,scatterColor,5,5
"A scatter plot is to be instantiated with 'Region' as the categorical variable, 'Sales' as the x-coordinate, and 'Profit' as the y-coordinate.",Non-technical-Technical,Subjective-Objective,command,superstore,scatterColor,4,5
"It is imperative to fabricate a Cartesian coordinate system, with 'Region' as chromatic differentiation, 'Sales' on the x-axis, and 'Profit' on the y-axis.",Colloquial-Standard,Non-technical-Technical,command,superstore,scatterColor,5,4
"Make a dot picture with colors showing where it's from, sales going across, and profit going up and down. I think it'll look good.",Non-technical-Technical,Subjective-Objective,command,superstore,scatterColor,1,1
"Please create a point chart. Use 'Region' for color, 'Sales' on the side, and 'Profit' up top.",Colloquial-Standard,Implicit-Explicit,command,superstore,scatterColor,4,5
"I reckon you should make a simple chart with colors for different regions, sales on the side, and profit going up.",Non-technical-Technical,Subjective-Objective,command,superstore,scatterColor,2,1
"Please fabricate a point distribution diagram. The variable 'Region' is represented by color, 'Sales' is plotted on the abscissa, and 'Profit' is plotted on the ordinate.",Non-technical-Technical,Implicit-Explicit,command,superstore,scatterColor,4,5
"This point chart, it presents 'Region' as the color, 'Sales' on the x-axis, and 'Profit' on the y-axis. This is a factual statement.",Colloquial-Standard,Subjective-Objective,query,superstore,scatterColor,4,2
"The chart utilizes colors to indicate regions, with sales on the horizontal line and profit on the vertical line.",Colloquial-Standard,Non-technical-Technical,query,superstore,scatterColor,1,4
"We could use a point chart, with colors for regions, sales on the x-axis, and profit on the y-axis.",Subjective-Objective,Implicit-Explicit,query,superstore,scatterColor,3,2
"Use a point chart, with colors for regions, sales on the x-axis, and profit on the y-axis.",Subjective-Objective,Implicit-Explicit,query,superstore,scatterColor,5,2
"The chart uses colors to represent regions, with sales on the x-axis and profit on the y-axis.",Colloquial-Standard,Non-technical-Technical,query,superstore,scatterColor,2,3
The scatter plot uses color coding to differentiate between regions. The x-axis represents sales and the y-axis represents profit.,Non-technical-Technical,Implicit-Explicit,query,superstore,scatterColor,5,5
"""The chart we are referring to represents regions in colors, with sales on the x-axis and profits on the y-axis.""",Colloquial-Standard,Implicit-Explicit,query,superstore,scatterColor,4,5
"""The point chart we are discussing represents regions in different colors, with sales plotted on the x-axis and profits on the y-axis.""",Colloquial-Standard,Implicit-Explicit,query,superstore,scatterColor,5,5
"Could you please fabricate a chart? I need 'Region' as color, 'Sales' on the x-axis, and 'Profit' on the y-axis.",Colloquial-Standard,Implicit-Explicit,question,superstore,scatterColor,4,5
"Could you please assemble a chart? I require 'Region' to be represented by color, 'Sales' on the x-axis, and 'Profit' on the y-axis.",Colloquial-Standard,Implicit-Explicit,question,superstore,scatterColor,5,2
"I would advise creating a chart with 'Central', 'East', 'West', 'South' as the columns, 'Sales' on the x-axis and 'Profit' on the y-axis.",Colloquial-Standard,Subjective-Objective,command,superstore,scatterFaceted,1,4
"I suggest that you create a chart with 'Central', 'East', 'West', 'South' as the columns, 'Sales' on the x-axis and 'Profit' on the y-axis.",Colloquial-Standard,Subjective-Objective,command,superstore,scatterFaceted,2,5
"A chart would be beneficial. With 'Central', 'East', 'West', 'South' as columns. 'Sales' could be on the x-axis and 'Profit' on the y-axis. Does that make sense?",Subjective-Objective,Implicit-Explicit,command,superstore,scatterFaceted,2,3
"""Please create a chart. The column field should be 'Central', 'East', 'West', 'South', the x-axis should be 'Sales', and the y-axis should be 'Profit'.""",Colloquial-Standard,Implicit-Explicit,command,superstore,scatterFaceted,5,5
"It is essential to create a point chart with 'Central', 'East', 'West', 'South' as the column fields, 'Sales' as the x-axis, and 'Profit' as the y-axis.",Colloquial-Standard,Non-technical-Technical,command,superstore,scatterFaceted,3,3
"A scatter plot is to be constructed with 'Central', 'East', 'West', 'South' as the column field, 'Sales' as the x-axis, and 'Profit' as the y-axis.",Non-technical-Technical,Subjective-Objective,command,superstore,scatterFaceted,5,3
"Create a point chart. Use 'Central', 'East', 'West', 'South' as the columns. 'Sales' as the horizontal axis, and 'Profit' as the vertical axis.",Non-technical-Technical,Implicit-Explicit,command,superstore,scatterFaceted,4,3
"Create a chart with 'Central', 'East', 'West', 'South' as the column field, 'Sales' as the x-axis, and 'Profit' as the y-axis. Is that explicit enough?",Subjective-Objective,Implicit-Explicit,command,superstore,scatterFaceted,5,3
"One is required to construct a point chart with 'Central', 'East', 'West', 'South' as the column parameters, 'Sales' as the x-coordinate, and 'Profit' as the y-coordinate.",Colloquial-Standard,Non-technical-Technical,command,superstore,scatterFaceted,4,4
"We need to create a chart with 'Central', 'East', 'West', 'South' as the column field, 'Sales' as the x-axis, and 'Profit' as the y-axis. Is that explicit enough?",Subjective-Objective,Implicit-Explicit,command,superstore,scatterFaceted,5,2
"A chart should be created. With 'Central', 'East', 'West', 'South' as columns. 'Sales' could be on the x-axis and 'Profit' on the y-axis. Does that make sense?",Subjective-Objective,Implicit-Explicit,command,superstore,scatterFaceted,2,5
"I recommend we instantiate a scatter plot with 'Central', 'East', 'West', 'South' as the column field, 'Sales' as the abscissa, and 'Profit' as the ordinate.",Non-technical-Technical,Subjective-Objective,command,superstore,scatterFaceted,1,5
"It is required to create a chart. 'Central', 'East', 'West', 'South' should be the columns, 'Sales' on the x-axis and 'Profit' on the y-axis.",Colloquial-Standard,Subjective-Objective,command,superstore,scatterFaceted,4,3
"I'd suggest making a chart with 'Central', 'East', 'West', 'South' in the columns, 'Sales' on the x and 'Profit' on the y.",Colloquial-Standard,Subjective-Objective,command,superstore,scatterFaceted,1,3
"Make a chart with dots. Use 'Central', 'East', 'West', 'South' for the columns. 'Sales' for the horizontal axis, and 'Profit' for the vertical axis.",Non-technical-Technical,Implicit-Explicit,command,superstore,scatterFaceted,3,2
We're looking at a scatter plot of sales versus profit by region.,Non-technical-Technical,Implicit-Explicit,query,superstore,scatterFaceted,1,3
"We're studying a point chart that explicitly shows the correlation between sales and profit in the Central, East, West, and South regions.",Non-technical-Technical,Implicit-Explicit,query,superstore,scatterFaceted,5,2
"We're examining a scatter plot that shows sales and profit in the Central, East, West, and South regions.",Non-technical-Technical,Implicit-Explicit,query,superstore,scatterFaceted,3,3
We're looking at a point chart of sales and profit by region. My gut tells me the West is leading the pack!,Colloquial-Standard,Subjective-Objective,query,superstore,scatterFaceted,1,3
"There's a chart that directly shows sales and profit in regions, specifically Central, East, West, and South.",Subjective-Objective,Implicit-Explicit,query,superstore,scatterFaceted,4,3
"This point chart represents the correlation between our sales volume and net profit in the central, eastern, western, and southern regions.",Colloquial-Standard,Non-technical-Technical,query,superstore,scatterFaceted,5,3
"A scatter diagram is provided, delineating the correlation between sales versus profit for the central, east, west, and south regions.",Non-technical-Technical,Subjective-Objective,query,superstore,scatterFaceted,5,5
What's the graph suggesting about the correlation between sales and profit in different regions?,Non-technical-Technical,Implicit-Explicit,question,superstore,scatterFaceted,1,2
What does the chart reveal about the relationship between 'Sales' and 'Profit' in these regions? There's some evidence to consider.,Colloquial-Standard,Subjective-Objective,question,superstore,scatterFaceted,3,4
How do you feel the chart shows the connection between sales and profit in different areas?,Non-technical-Technical,Subjective-Objective,question,superstore,scatterFaceted,1,2
"Maybe we could do a line chart? 'Order Date' on the x-axis, total 'Sales' on the y-axis, and show the 'Category' differences.",Colloquial-Standard,Subjective-Objective,command,superstore,multiLine,1,3
"It is suggested to generate a line chart with 'Order Date' on the x-axis and sum of 'Sales' on the y-axis, differentiated by 'Category'.",Non-technical-Technical,Subjective-Objective,command,superstore,multiLine,4,4
Please create a line chart that shows the total sales for each product category over time.,Non-technical-Technical,Implicit-Explicit,command,superstore,multiLine,4,3
"""Please create a line chart. The x-axis should represent the 'Order Date' and the y-axis should represent the sum of 'Sales'. Each 'Category' should be clearly differentiated.""",Colloquial-Standard,Implicit-Explicit,command,superstore,multiLine,5,1
Create a graph that clearly shows the total sales for each product category over time.,Non-technical-Technical,Implicit-Explicit,command,superstore,multiLine,5,2
A line chart with 'Order Date' and sum of 'Sales' would be useful. We could differentiate it by 'Category'.,Subjective-Objective,Implicit-Explicit,command,superstore,multiLine,1,4
We need a line chart with 'Order Date' on the x-axis and the sum of 'Sales' on the y-axis. It should clearly differentiate by 'Category'.,Colloquial-Standard,Subjective-Objective,command,superstore,multiLine,4,1
How about a line chart with 'Order Date' and sum of 'Sales'? We could differentiate it by 'Category'.,Subjective-Objective,Implicit-Explicit,command,superstore,multiLine,2,2
Consider a line chart with 'Order Date' and sum of 'Sales'. We could differentiate it by 'Category'.,Subjective-Objective,Implicit-Explicit,command,superstore,multiLine,2,4
"You are tasked to generate a line chart with the 'Order Date' on the x-axis and the aggregate of 'Sales' on the y-axis, differentiated by 'Category'.",Colloquial-Standard,Non-technical-Technical,command,superstore,multiLine,5,2
Create a line chart that clearly shows the total sales for each product category over time.,Non-technical-Technical,Implicit-Explicit,command,superstore,multiLine,5,3
"""We require a line chart. 'Order Date' on the x-axis, sum of 'Sales' on the y-axis, and 'Category' differentiated.""",Colloquial-Standard,Implicit-Explicit,command,superstore,multiLine,3,4
"This line chart depicts the temporal progression of the summation of sales, categorized by product type.",Colloquial-Standard,Non-technical-Technical,query,superstore,multiLine,5,1
This is a line chart with dates and sales for each category.,Colloquial-Standard,Implicit-Explicit,query,superstore,multiLine,1,4
"The line chart represents the sum of sales for each category, organized by date.",Colloquial-Standard,Implicit-Explicit,query,superstore,multiLine,5,2
"I believe this is a line chart, showing sales totals by category over time.",Subjective-Objective,Implicit-Explicit,query,superstore,multiLine,3,1
This is a graph showing sales by product type over time.,Non-technical-Technical,Implicit-Explicit,query,superstore,multiLine,3,1
"This line graph, it's got the date, month and year, and it's showing the total sales for each category. It's just the facts, no opinions.",Colloquial-Standard,Subjective-Objective,query,superstore,multiLine,4,1
"The line chart displays the sum of sales for each category, organized by date.",Colloquial-Standard,Implicit-Explicit,query,superstore,multiLine,4,3
This line chart clearly shows the sum of sales by product category over order date.,Non-technical-Technical,Implicit-Explicit,query,superstore,multiLine,4,5
Would you be able to elucidate how the summation of sales data is varying temporally for each category?,Colloquial-Standard,Non-technical-Technical,question,superstore,multiLine,5,4
"I'm wondering how the total sales for each category change over time, what do you think?",Non-technical-Technical,Subjective-Objective,question,superstore,multiLine,1,2
"I feel like there's some kind of pattern in the sales for each category over time, don't you think?",Subjective-Objective,Implicit-Explicit,question,superstore,multiLine,1,1
Make a bar graph with 'How long it runs' on the bottom and the number of times it happens on the side.,Colloquial-Standard,Non-technical-Technical,command,movies,histogram,1,1
It is compulsory to produce a bar diagram with 'Running Time' on the abscissa and the enumeration of records on the ordinate.,Colloquial-Standard,Non-technical-Technical,command,movies,histogram,5,4
"Create a bar chart. 'Running Time' on the x-axis, count of records on the y-axis.",Colloquial-Standard,Implicit-Explicit,command,movies,histogram,4,5
Please create a bar chart with 'Running Time' on the x-axis and the count of records on the y-axis.,Colloquial-Standard,Non-technical-Technical,command,movies,histogram,1,3
"Make a picture with lines going up for how many times something happens, and lines going across for how long something takes.",Non-technical-Technical,Implicit-Explicit,command,movies,histogram,1,1
"I propose the creation of a bar chart, 'Running Time' on the x-axis, count of records on the y-axis.",Colloquial-Standard,Implicit-Explicit,command,movies,histogram,2,5
"Create a bar chart. 'Running Time' on the x-axis, count of records on the y-axis.",Colloquial-Standard,Implicit-Explicit,command,movies,histogram,4,4
Make a bar chart with 'Running Time' on the horizontal axis and the frequency on the vertical axis.,Colloquial-Standard,Non-technical-Technical,command,movies,histogram,3,1
It is advisable to create a bar chart with 'Running Time' on the x-axis and the count of records on the y-axis.,Colloquial-Standard,Subjective-Objective,command,movies,histogram,4,3
"You know, like a bar chart with time and counts.",Non-technical-Technical,Implicit-Explicit,command,movies,histogram,1,3
Make a picture with bars that shows how long each thing runs for and how many things there are.,Non-technical-Technical,Subjective-Objective,command,movies,histogram,1,1
One must create a bar chart with 'Running Time' on the x-axis and the count of records on the y-axis.,Colloquial-Standard,Non-technical-Technical,command,movies,histogram,1,5
"Could you make a bar chart with 'Running Time' on the x-axis and the count of records on the y-axis, please?",Colloquial-Standard,Subjective-Objective,command,movies,histogram,1,2
Construct a bar graph with 'Running Time' as the abscissa and the frequency of records as the ordinate.,Non-technical-Technical,Subjective-Objective,command,movies,histogram,3,5
"Create a bar chart, with 'Running Time' on the x-axis and the count of records on the y-axis.",Subjective-Objective,Implicit-Explicit,command,movies,histogram,5,3
"Make a bar graph thingy with 'Running Time' on the bottom and the number of records on the side, you know?",Colloquial-Standard,Subjective-Objective,command,movies,histogram,1,1
Generate a bar chart where the x-axis signifies 'Running Time' and the y-axis signifies the count of records.,Non-technical-Technical,Implicit-Explicit,command,movies,histogram,5,5
The bar chart provides a visual representation of 'Running Time' and the count of records.,Colloquial-Standard,Non-technical-Technical,query,movies,histogram,2,5
The bar chart objectively demonstrates the quantitative representation of records and their temporal duration.,Non-technical-Technical,Subjective-Objective,query,movies,histogram,5,5
"This bar chart seems to be about running time, and it's counting records.",Subjective-Objective,Implicit-Explicit,query,movies,histogram,3,1
"This bar chart here, it's about 'Running Time' and the number of times it's been recorded.",Colloquial-Standard,Subjective-Objective,query,movies,histogram,1,2
"This is a bar chart, it shows 'Running Time' and the count of records.",Colloquial-Standard,Non-technical-Technical,query,movies,histogram,2,2
This bar chart clearly shows the running time and counts the records.,Subjective-Objective,Implicit-Explicit,query,movies,histogram,4,5
The bar chart provides a visual representation of 'Running Time' and the enumeration of data entries.,Colloquial-Standard,Non-technical-Technical,query,movies,histogram,4,5
The bar chart is demonstrating the quantitative representation of records and their temporal duration.,Non-technical-Technical,Subjective-Objective,query,movies,histogram,3,5
"We have a bar chart here, titled 'Running Time', with a number of records tallied.",Non-technical-Technical,Implicit-Explicit,query,movies,histogram,2,3
Can you count how many times each 'Running Time' appears in the bar chart?,Non-technical-Technical,Subjective-Objective,question,movies,histogram,3,1
Can you count how many of each 'Running Time' there are in that bar chart?,Colloquial-Standard,Subjective-Objective,question,movies,histogram,3,1
What is the frequency of each 'Running Time' in the bar chart?,Colloquial-Standard,Non-technical-Technical,question,movies,histogram,3,3
"I'm curious, how many records are there for each 'Running Time' in the bar chart?",Colloquial-Standard,Subjective-Objective,question,movies,histogram,1,3
"Make a bar chart, 'Creative Type' on the x, count on the y, you know?",Colloquial-Standard,Implicit-Explicit,command,movies,singleAttrBar,2,1
It is required to create a bar chart with 'Creative Type' on the x-axis and its count on the y-axis.,Colloquial-Standard,Non-technical-Technical,command,movies,singleAttrBar,2,4
Generate a bar diagram with 'Creative Type' as the abscissa and its count as the ordinate.,Colloquial-Standard,Non-technical-Technical,command,movies,singleAttrBar,4,1
Fabricate a bar chart with 'Creative Type' as the x-coordinate and its enumeration as the y-coordinate.,Colloquial-Standard,Non-technical-Technical,command,movies,singleAttrBar,5,1
Please make a bar chart with 'Creative Type' on the x-axis and the count on the y-axis.,Colloquial-Standard,Non-technical-Technical,command,movies,singleAttrBar,1,3
Please proceed with creating a bar chart with 'Creative Type' on the x-axis and its count on the y-axis.,Colloquial-Standard,Subjective-Objective,command,movies,singleAttrBar,3,4
